{
  "$schema": "./governance.schema.json",
  "principal": {
    "name": "Dr. B. R. Hiremath",
    "role": "Principal & Member Secretary",
    "photo": "governance/principal/cine2151.webp",
    "email": "becprincipal@yahoo.com"
  },
  "deans": [
    {
      "role": "Dean (Academics)",
      "name": "Dr. P. N. Kulkarni",
      "photo": "governance/deans/dr-p-n-kulkarni.webp",
      "email": "pnk_bewoor@yahoo.com",
      "focus": "Programs & curriculum"
    },
    {
      "role": "Dean (R&D) and ICT",
      "name": "Dr. Mahabaleshwar S. K.",
      "photo": "governance/deans/dr-mahabaleshwar-s-k.webp",
      "email": "mahabalesh_sk@yahoo.co.in",
      "focus": "Research, innovation, consultancy & ICT infrastructure",
      "roleBadges": [
        {
          "label": "Dean (R&D)",
          "link": {
            "href": "/research",
            "label": "View Research & Development"
          }
        },
        {
          "label": "Dean (ICT)",
          "link": {
            "href": "/institute/dean-ict",
            "label": "View Dean (ICT) Office"
          }
        }
      ]
    },
    {
      "role": "Dean (Career Guidance & Placement)",
      "name": "Dr. S. G. Kambalimath",
      "photo": "governance/deans/dr-shankar-kambalimath.webp",
      "email": "becplacement@gmail.com",
      "focus": "Career services & placements"
    },
    {
      "role": "Dean (Student Welfare)",
      "name": "Dr. Bharati S. Meti",
      "photo": "governance/deans/dr-bharati-s-meti.webp",
      "email": "dswbec@gmail.com",
      "focus": "Student welfare & support"
    }
  ],
  "officers": [
    {
      "role": "Controller of Examinations",
      "name": "Dr. K. Chandrasekhar",
      "photo": "governance/hod/coe/dr-chandrashekhar-k.webp",
      "focus": "Examinations & evaluation"
    },
    {
      "role": "Librarian",
      "name": "Dr. Shreekant G. Karkun",
      "photo": "governance/hod/librarian/dr-shreekant-g-karkun.webp",
      "focus": "Central library & digital resources"
    }
  ],
  "hods": [
    {
      "department": "Civil Engineering",
      "name": "Dr. S. H. Sanni",
      "photo": "governance/hod/civil/dr-s-h-sanni.webp"
    },
    {
      "department": "Mechanical Engineering",
      "name": "Dr. Vinay V. Kuppast",
      "photo": "governance/hod/mechanical/dr-vinay-v-kuppast.webp"
    },
    {
      "department": "Electrical & Electronics Engineering",
      "name": "Dr. R. L. Naik",
      "photo": "governance/hod/eee/dr-r-l-naik.webp"
    },
    {
      "department": "Computer Science & Engineering",
      "name": "Dr. V. B. Pagi",
      "photo": "governance/hod/cse/dr-v-b-pagi.webp"
    },
    {
      "department": "Industrial & Production Engineering",
      "name": "Dr. C. M. Javalagi",
      "photo": "governance/hod/ip/dr-c-m-javalagi.webp"
    },
    {
      "department": "Electronics & Communication Engineering",
      "name": "Dr. Mahabaleshwar S. K.",
      "photo": "governance/hod/ece/dr-mahabaleshwar-s-k.webp"
    },
    {
      "department": "Information Science & Engineering",
      "name": "Dr. Lokesh B. Bhajantri",
      "photo": "governance/hod/ise/dr-lokesh-b-bhajantri.webp"
    },
    {
      "department": "Biotechnology",
      "name": "Dr. Bharati S. Meti",
      "photo": "governance/hod/biotechnology/dr-bharati-s-meti.webp"
    },
    {
      "department": "Artificial Intelligence & Machine Learning",
      "name": "Dr. B. M. Reshmi",
      "photo": "governance/hod/aiml/dr-b-m-reshmi.webp"
    },
    {
      "department": "Electronics & Computer Engineering",
      "name": "Dr. Chayalakshmi C. L.",
      "photo": "governance/hod/ecs/dr-c-l-chayalakshmi.webp"
    },
    {
      "department": "Physics",
      "name": "Prof. R. P. Araganji",
      "photo": "departments/physics/faculty/ratnaprabha-p-araganji.webp"
    },
    {
      "department": "Chemistry",
      "name": "Dr. S. K. Patil",
      "photo": "governance/hod/chemistry/dr-s-k-patil.webp"
    },
    {
      "department": "Mathematics",
      "name": "Dr. S. V. Gurushanthanavar",
      "photo": "governance/hod/maths/dr-s-v-gurushanthanavar.webp"
    },
    {
      "department": "MCA",
      "name": "Sri S. M. Magi",
      "photo": "governance/hod/mca/sri-s-m-magi.webp"
    },
    {
      "department": "MBA",
      "name": "Dr. Vinod S. Puranik",
      "photo": "governance/hod/mba/dr-vinod-s-puranik.webp"
    },
    {
      "department": "Humanities",
      "name": "Dr. B. G. Hokarani",
      "photo": "governance/hod/hss/dr-b-g-hokarani.webp"
    }
  ],
  "sangha": {
    "intro": "Basaveshwar Veerashaiva Vidyavardhak Sangha (B.V.V. Sangha), established in 1906, is the parent trust that runs BEC and 190+ institutions across Karnataka and Southern Maharashtra under the philosophy “Work is Worship”.",
    "groupPhoto": "governance/sangha/group-photo.webp",
    "chairman": {
      "name": "Dr. Veeranna C. Charantimath",
      "role": "Chairman, B.V.V. Sangha",
      "photo": "governance/chairman.jpg",
      "messageHref": "/institute/chairperson"
    },
    "secretary": {
      "name": "Sri Mahesh N. Athani",
      "role": "Secretary, B.V.V. Sangha",
      "photo": "governance/sangha/sri-mahesh-n-athani.webp"
    },
    "members": [
      {
        "name": "Dr. Vijayakumar S. Katagihallimath",
        "role": "B.V.V. Sangha Office Bearer",
        "photo": "governance/sangha/dr-vijayakumar-s-katagihallimath.webp"
      }
    ],
    "council": [
      {
        "name": "Dr. Veeranna C. Charantimath",
        "role": "Chairman"
      },
      {
        "name": "Sri. Mahesh N. Athani",
        "role": "Member"
      },
      {
        "name": "Sri. Andanappa M. Shettar",
        "role": "Member"
      },
      {
        "name": "Sri. Chennabasavaraj V. Koti",
        "role": "Member"
      },
      {
        "name": "Sri. Rajendra M. Tapashetti",
        "role": "Member"
      },
      {
        "name": "Sri. Channayya P. Balulmath",
        "role": "Member"
      },
      {
        "name": "Sri. Basavaraj M. Talikoti",
        "role": "Member"
      },
      {
        "name": "Sri. Rudrappa S. Akkimaradi",
        "role": "Member"
      },
      {
        "name": "Sri. Gurusiddappa (Kumar) G. Yalligutti",
        "role": "Member"
      },
      {
        "name": "Dr. B. R. Hiremath",
        "role": "Principal, Member Secretary"
      },
      {
        "name": "Prof. V. R. Shirol",
        "role": "Administrative Officer, B.V.V. Sangha, Bagalkot",
        "invitee": true
      },
      {
        "name": "Dr. V. S. Katagihallimath",
        "role": "Administrative Officer, B.V.V. Sangha, Bagalkot",
        "invitee": true
      },
      {
        "name": "Dr. R. N. Herkal",
        "role": "Director of Technical Institutions, B.V.V. Sangha, Bagalkot",
        "invitee": true
      }
    ]
  },
  "bog": [
    {
      "name": "Dr. R. N. Herkal",
      "role": "Chairman",
      "affiliation": "Director (Technical Education), B.V.V. Sangha & Professor, Department of Civil Engineering, Basaveshwar Engineering College, Bagalkote",
      "category": "chair"
    },
    {
      "name": "Dr. Meena Chandavarkar",
      "role": "Member",
      "affiliation": "Chief Advisor, B.V.V. Sangha, Bagalkote & Former Vice Chancellor, Karnataka State Akkamahadevi Women's University, Vijayapura",
      "category": "sangha"
    },
    {
      "name": "Shri Kumar S. Jigajinni",
      "role": "Member",
      "affiliation": "Chartered Accountant & Honorable Member, B.V.V. Sangha, Bagalkote",
      "category": "sangha"
    },
    {
      "name": "Shri Rudrappa S. Akkimardi",
      "role": "Member",
      "affiliation": "Honorable Member, B.V.V. Sangha, Bagalkote",
      "category": "sangha"
    },
    {
      "name": "Prof. V. R. Shirol",
      "role": "Member",
      "affiliation": "Administrative Officer, B.V.V. Sangha, Bagalkote",
      "category": "sangha"
    },
    {
      "name": "Dr. K. Chandrasekhar",
      "role": "Member",
      "affiliation": "Controller of Examinations & Professor, Department of Physics, Basaveshwar Engineering College, Bagalkote",
      "category": "faculty",
      "photo": "governance/hod/coe/dr-chandrashekhar-k.webp"
    },
    {
      "name": "Dr. P. N. Kulkarni",
      "role": "Member",
      "affiliation": "Dean (Academics) & Associate Professor, Department of Electronics & Communication Engineering, Basaveshwar Engineering College, Bagalkote",
      "category": "faculty",
      "photo": "governance/deans/dr-p-n-kulkarni.webp"
    },
    {
      "name": "Shri Ananth S. Onkar",
      "role": "Member",
      "affiliation": "Office Superintendent, Basaveshwar Engineering College, Bagalkote",
      "category": "faculty"
    },
    {
      "name": "Shri R. S. Hiremath",
      "role": "Member",
      "affiliation": "Founder & Managing Director, Flexitron, Bengaluru",
      "category": "industry"
    },
    {
      "name": "Dr. G. T. Raju",
      "role": "Member",
      "affiliation": "VTU, Belagavi Nominee — Member, Academic Senate, VTU & Principal, S.J.C. Institute of Technology, Chikkaballapur",
      "category": "nominee"
    },
    {
      "name": "Dr. Muniraju M.",
      "role": "Member",
      "affiliation": "DTE, Karnataka Government Nominee — Principal, Government Engineering College, Haveri",
      "category": "government"
    },
    {
      "name": "Dr. B. R. Hiremath",
      "role": "Member Secretary",
      "affiliation": "Principal, Basaveshwar Engineering College, Bagalkote",
      "category": "member-secretary",
      "photo": "governance/principal/cine2151.webp"
    },
    {
      "name": "PG Students – 2 Nos. (01 Male & 01 Female)",
      "role": "Invitee",
      "affiliation": "Postgraduate student representatives",
      "category": "students"
    },
    {
      "name": "UG Students – 2 Nos. (01 Male & 01 Female)",
      "role": "Invitee",
      "affiliation": "Undergraduate student representatives",
      "category": "students"
    }
  ]
}
